{
    "$schema": "https://streams.dev/schema/catalog.schema.json",
    "version": 1,
    "source": {
        "core": "vendor/streams/core/src/Field/Types",
        "ui": "resources/catalog/ui-builders.manifest.json (streams/ui is not installed)"
    },
    "field_types": [
        {
            "handle": "array",
            "class": "Streams\\Core\\Field\\Types\\ArrayFieldType",
            "schema": "Streams\\Core\\Field\\Schema\\ArraySchema",
            "decorator": "Streams\\Core\\Field\\Decorator\\ArrayDecorator",
            "config": {},
            "defaults": {},
            "allowed_parents": [
                "stream"
            ]
        },
        {
            "handle": "boolean",
            "class": "Streams\\Core\\Field\\Types\\BooleanFieldType",
            "schema": "Streams\\Core\\Field\\Schema\\BooleanSchema",
            "decorator": "Streams\\Core\\Field\\Decorator\\BooleanDecorator",
            "config": {},
            "defaults": {},
            "allowed_parents": [
                "stream"
            ]
        },
        {
            "handle": "color",
            "class": "Streams\\Core\\Field\\Types\\ColorFieldType",
            "schema": "Streams\\Core\\Field\\Schema\\StringSchema",
            "decorator": "Streams\\Core\\Field\\Decorator\\ColorDecorator",
            "config": {},
            "defaults": {},
            "allowed_parents": [
                "stream"
            ]
        },
        {
            "handle": "date",
            "class": "Streams\\Core\\Field\\Types\\DateFieldType",
            "schema": "Streams\\Core\\Field\\Schema\\DateSchema",
            "decorator": "Streams\\Core\\Field\\Decorator\\DateDecorator",
            "config": {},
            "defaults": {},
            "allowed_parents": [
                "stream"
            ]
        },
        {
            "handle": "datetime",
            "class": "Streams\\Core\\Field\\Types\\DatetimeFieldType",
            "schema": "Streams\\Core\\Field\\Schema\\DatetimeSchema",
            "decorator": "Streams\\Core\\Field\\Decorator\\DatetimeDecorator",
            "config": {},
            "defaults": {},
            "allowed_parents": [
                "stream"
            ]
        },
        {
            "handle": "decimal",
            "class": "Streams\\Core\\Field\\Types\\DecimalFieldType",
            "schema": "Streams\\Core\\Field\\Schema\\DecimalSchema",
            "decorator": "Streams\\Core\\Field\\Decorator\\DecimalDecorator",
            "config": {},
            "defaults": {},
            "allowed_parents": [
                "stream"
            ]
        },
        {
            "handle": "email",
            "class": "Streams\\Core\\Field\\Types\\EmailFieldType",
            "schema": "Streams\\Core\\Field\\Schema\\EmailSchema",
            "decorator": "Streams\\Core\\Field\\Decorator\\EmailDecorator",
            "config": {},
            "defaults": {},
            "allowed_parents": [
                "stream"
            ]
        },
        {
            "handle": "encrypted",
            "class": "Streams\\Core\\Field\\Types\\EncryptedFieldType",
            "schema": "Streams\\Core\\Field\\Schema\\EncryptedSchema",
            "decorator": "Streams\\Core\\Field\\Decorator\\EncryptedDecorator",
            "config": {},
            "defaults": {},
            "allowed_parents": [
                "stream"
            ]
        },
        {
            "handle": "file",
            "class": "Streams\\Core\\Field\\Types\\FileFieldType",
            "schema": "Streams\\Core\\Field\\Schema\\StringSchema",
            "decorator": "Streams\\Core\\Field\\Decorator\\FileDecorator",
            "config": {},
            "defaults": {},
            "allowed_parents": [
                "stream"
            ]
        },
        {
            "handle": "hash",
            "class": "Streams\\Core\\Field\\Types\\HashFieldType",
            "schema": "Streams\\Core\\Field\\Schema\\HashSchema",
            "decorator": "Streams\\Core\\Field\\Decorator\\HashDecorator",
            "config": {},
            "defaults": {},
            "allowed_parents": [
                "stream"
            ]
        },
        {
            "handle": "image",
            "class": "Streams\\Core\\Field\\Types\\ImageFieldType",
            "schema": "Streams\\Core\\Field\\Schema\\StringSchema",
            "decorator": "Streams\\Core\\Field\\Decorator\\ImageDecorator",
            "config": {},
            "defaults": {},
            "allowed_parents": [
                "stream"
            ]
        },
        {
            "handle": "integer",
            "class": "Streams\\Core\\Field\\Types\\IntegerFieldType",
            "schema": "Streams\\Core\\Field\\Schema\\IntegerSchema",
            "decorator": "Streams\\Core\\Field\\Decorator\\IntegerDecorator",
            "config": {},
            "defaults": {},
            "allowed_parents": [
                "stream"
            ]
        },
        {
            "handle": "markdown",
            "class": "Streams\\Core\\Field\\Types\\MarkdownFieldType",
            "schema": "Streams\\Core\\Field\\FieldSchema",
            "decorator": "Streams\\Core\\Field\\Decorator\\MarkdownDecorator",
            "config": {},
            "defaults": {},
            "allowed_parents": [
                "stream"
            ]
        },
        {
            "handle": "multiselect",
            "class": "Streams\\Core\\Field\\Types\\MultiselectFieldType",
            "schema": "Streams\\Core\\Field\\Schema\\MultiselectSchema",
            "decorator": "Streams\\Core\\Field\\Decorator\\MultiselectDecorator",
            "config": {
                "options": {
                    "type": "object|string",
                    "required": true,
                    "description": "The selectable options keyed by value."
                }
            },
            "defaults": {
                "options": []
            },
            "allowed_parents": [
                "stream"
            ]
        },
        {
            "handle": "number",
            "class": "Streams\\Core\\Field\\Types\\NumberFieldType",
            "schema": "Streams\\Core\\Field\\Schema\\NumberSchema",
            "decorator": "Streams\\Core\\Field\\Decorator\\NumberDecorator",
            "config": {},
            "defaults": {},
            "allowed_parents": [
                "stream"
            ]
        },
        {
            "handle": "object",
            "class": "Streams\\Core\\Field\\Types\\ObjectFieldType",
            "schema": "Streams\\Core\\Field\\Schema\\ObjectSchema",
            "decorator": "Streams\\Core\\Field\\FieldDecorator",
            "config": {
                "allowed": {
                    "type": "object",
                    "required": false,
                    "description": "Nested objects: {\"stream\": ...}, {\"generic\": ...} or {\"prototype\": ...}."
                },
                "properties": {
                    "type": "object",
                    "required": false,
                    "description": "Inline nested field definitions."
                }
            },
            "defaults": {},
            "allowed_parents": [
                "stream",
                "object"
            ]
        },
        {
            "handle": "relationship",
            "class": "Streams\\Core\\Field\\Types\\RelationshipFieldType",
            "schema": "Streams\\Core\\Field\\FieldSchema",
            "decorator": "Streams\\Core\\Field\\FieldDecorator",
            "config": {
                "related": {
                    "type": "string|array",
                    "required": true,
                    "description": "One stream id, or a list of ids for polymorphic and multi-target fields."
                }
            },
            "defaults": {
                "related": null
            },
            "allowed_parents": [
                "stream"
            ]
        },
        {
            "handle": "select",
            "class": "Streams\\Core\\Field\\Types\\SelectFieldType",
            "schema": "Streams\\Core\\Field\\Schema\\SelectSchema",
            "decorator": "Streams\\Core\\Field\\Decorator\\SelectDecorator",
            "config": {
                "options": {
                    "type": "object|string",
                    "required": true,
                    "description": "The selectable options keyed by value."
                }
            },
            "defaults": {
                "options": []
            },
            "allowed_parents": [
                "stream"
            ]
        },
        {
            "handle": "slug",
            "class": "Streams\\Core\\Field\\Types\\SlugFieldType",
            "schema": "Streams\\Core\\Field\\Schema\\StringSchema",
            "decorator": "Streams\\Core\\Field\\Decorator\\StringDecorator",
            "config": {},
            "defaults": {},
            "allowed_parents": [
                "stream"
            ]
        },
        {
            "handle": "string",
            "class": "Streams\\Core\\Field\\Types\\StringFieldType",
            "schema": "Streams\\Core\\Field\\Schema\\StringSchema",
            "decorator": "Streams\\Core\\Field\\Decorator\\StringDecorator",
            "config": {},
            "defaults": {},
            "allowed_parents": [
                "stream"
            ]
        },
        {
            "handle": "time",
            "class": "Streams\\Core\\Field\\Types\\TimeFieldType",
            "schema": "Streams\\Core\\Field\\Schema\\TimeSchema",
            "decorator": "Streams\\Core\\Field\\Decorator\\DatetimeDecorator",
            "config": {},
            "defaults": {},
            "allowed_parents": [
                "stream"
            ]
        },
        {
            "handle": "url",
            "class": "Streams\\Core\\Field\\Types\\UrlFieldType",
            "schema": "Streams\\Core\\Field\\Schema\\UrlSchema",